{"trace_version":"1.0","requirements":[{"requirement_id":"POE-REQ-001","source_locator":"Signed contract: project scope and deliverable inventory","criterion":"Register and trace the full controlled corpus without redistributing restricted binaries.","asset_ids":["POE-ASSET-0003","POE-ASSET-0138","POE-ASSET-0139"],"verification_method":"Registry count/hash and requirement trace audit","status":"NOT_EVALUATED","deviation":null,"approver":null,"gate":"G1","evidence_state":"LOCATED_NOT_REQUALIFIED"},{"requirement_id":"POE-REQ-002","source_locator":"Signed contract / kinetics deliverables","criterion":"Provide POE copolymerization reaction network, rate equations and parameter basis.","asset_ids":["POE-ASSET-0005","POE-ASSET-0128","POE-ASSET-0138"],"verification_method":"Equation-to-code review, unit analysis and independent fixtures","status":"HOLD","deviation":"Historical MATLAB implementation contains unresolved equation/index/unit questions; isolated from the reference kernel.","approver":null,"gate":"G5","evidence_state":"LOCATED_NOT_REQUALIFIED"},{"requirement_id":"POE-REQ-003","source_locator":"EPR kinetics deliverable","criterion":"Provide ethylene/propylene copolymerization kinetics evidence and model assets.","asset_ids":["POE-ASSET-0004","POE-ASSET-0129","POE-ASSET-0135"],"verification_method":"Model passport and independent validation","status":"NOT_EVALUATED","deviation":null,"approver":null,"gate":"G5","evidence_state":"LOCATED_NOT_REQUALIFIED"},{"requirement_id":"POE-REQ-004","source_locator":"Contract reactor-model requirement","criterion":"Develop reactor selection/design basis including CSTR/PFR, mixing and heat removal.","asset_ids":["POE-ASSET-0138","POE-ASSET-0139"],"verification_method":"Reactor model dossier, balances and scale-specific acceptance","status":"NOT_EVALUATED","deviation":null,"approver":null,"gate":"G7","evidence_state":"LOCATED_NOT_REQUALIFIED"},{"requirement_id":"POE-REQ-005","source_locator":"Pilot-scale steady-state process deliverable","criterion":"Provide a pilot/1 kt/y steady-state flowsheet and report.","asset_ids":["POE-ASSET-0111","POE-ASSET-0112","POE-ASSET-0113","POE-ASSET-0114"],"verification_method":"Content-level package audit and independent mass/energy closure","status":"HOLD","deviation":"Historical pilot steady model reportedly did not fully close the recycle loop.","approver":null,"gate":"G9","evidence_state":"LOCATED_NOT_REQUALIFIED"},{"requirement_id":"POE-REQ-006","source_locator":"Pilot-scale dynamic process deliverable","criterion":"Provide a pilot/1 kt/y dynamic case, disturbance tests and operating report.","asset_ids":["POE-ASSET-0029","POE-ASSET-0031","POE-ASSET-0032"],"verification_method":"Dynamic asset presence, initialization, ±10% disturbance and recovery criteria","status":"NOT_EVALUATED","deviation":null,"approver":null,"gate":"G14","evidence_state":"LOCATED_NOT_REQUALIFIED"},{"requirement_id":"POE-REQ-007","source_locator":"200 kt/y steady-state data-package deliverable","criterion":"Provide a 200 kt/y steady-state flowsheet and process data package.","asset_ids":["POE-ASSET-0121","POE-ASSET-0122","POE-ASSET-0123","POE-ASSET-0124"],"verification_method":"Content-level package audit and independent balances","status":"NOT_EVALUATED","deviation":null,"approver":null,"gate":"G13","evidence_state":"LOCATED_NOT_REQUALIFIED"},{"requirement_id":"POE-REQ-008","source_locator":"Summary-report dynamic claim at 200 kt/y","criterion":"Provide traceable evidence for any 200 kt/y full-process dynamic-model claim.","asset_ids":["POE-ASSET-0121","POE-ASSET-0122","POE-ASSET-0138"],"verification_method":"Require matching dynamic report and dynamic binary identity","status":"HOLD","deviation":"No matching 200 kt/y dynamic report or .dynf asset was found in the audited corpus.","approver":null,"gate":"G14","evidence_state":"LOCATED_NOT_REQUALIFIED"},{"requirement_id":"POE-REQ-009","source_locator":"Contract/report property-method requirement","criterion":"Qualify VLE, density, enthalpy, heat capacity, viscosity and transport methods over the operating envelope.","asset_ids":["POE-ASSET-0111","POE-ASSET-0121","POE-ASSET-0138"],"verification_method":"Method passport, benchmark errors, range and extrapolation audit","status":"NOT_EVALUATED","deviation":null,"approver":null,"gate":"G5","evidence_state":"LOCATED_NOT_REQUALIFIED"},{"requirement_id":"POE-REQ-010","source_locator":"Contract material/energy-balance requirement","criterion":"Close component, total mass, energy, solvent, impurity, VOC and water balances.","asset_ids":["POE-ASSET-0111","POE-ASSET-0121"],"verification_method":"Independent balance kernel with declared tolerance","status":"HOLD","deviation":null,"approver":null,"gate":"G9","evidence_state":"LOCATED_NOT_REQUALIFIED"},{"requirement_id":"POE-REQ-011","source_locator":"Devolatilization/finishing deliverable","criterion":"Define and justify flash, preconcentration, devolatilization/steam stripping and finishing.","asset_ids":["POE-ASSET-0120","POE-ASSET-0111","POE-ASSET-0121"],"verification_method":"Non-equilibrium boundary and residual-volatiles acceptance","status":"NOT_EVALUATED","deviation":null,"approver":null,"gate":"G9","evidence_state":"LOCATED_NOT_REQUALIFIED"},{"requirement_id":"POE-REQ-012","source_locator":"Solvent/comonomer recovery and recycle requirement","criterion":"Close recycle connections, impurity memory and purge basis.","asset_ids":["POE-ASSET-0006","POE-ASSET-0022","POE-ASSET-0111"],"verification_method":"Topology, recycle closure and impurity accumulation tests","status":"HOLD","deviation":"High-boiler and comonomer overhead return streams were not demonstrably connected back to polymerization.","approver":null,"gate":"G9","evidence_state":"LOCATED_NOT_REQUALIFIED"},{"requirement_id":"POE-REQ-013","source_locator":"PFD and process-description deliverable","criterion":"Provide process topology and narrative consistent with streams and equipment.","asset_ids":["POE-ASSET-0111","POE-ASSET-0121","POE-ASSET-0139"],"verification_method":"Cross-reference PFD, streams and equipment","status":"NOT_EVALUATED","deviation":null,"approver":null,"gate":"G13","evidence_state":"LOCATED_NOT_REQUALIFIED"},{"requirement_id":"POE-REQ-014","source_locator":"Equipment/instrument/control/piping data requirement","criterion":"Provide equipment, utilities, instrumentation, control and piping interfaces.","asset_ids":["POE-ASSET-0109","POE-ASSET-0121","POE-ASSET-0139"],"verification_method":"Structured records and named engineering review","status":"NOT_EVALUATED","deviation":null,"approver":null,"gate":"G13","evidence_state":"LOCATED_NOT_REQUALIFIED"},{"requirement_id":"POE-REQ-015","source_locator":"Programs/models/reports deliverable","criterion":"Preserve executable-program/model identities and documented restoration/use instructions.","asset_ids":["POE-ASSET-0005","POE-ASSET-0110","POE-ASSET-0115","POE-ASSET-0123"],"verification_method":"Asset passport, software version, hash and clean restoration test","status":"HOLD","deviation":"Commercial software versions and clean restoration evidence are incomplete.","approver":null,"gate":"G7","evidence_state":"LOCATED_NOT_REQUALIFIED"},{"requirement_id":"POE-REQ-016","source_locator":"Chinese manual requirement","criterion":"Provide Chinese instructions for controlled simulator/model assets.","asset_ids":["POE-ASSET-0110"],"verification_method":"Manual coverage against canonical assets","status":"NOT_EVALUATED","deviation":null,"approver":null,"gate":"G17","evidence_state":"LOCATED_NOT_REQUALIFIED"},{"requirement_id":"POE-REQ-017","source_locator":"Contract numerical accuracy criterion","criterion":"Where the contract applies an 8% relative-error criterion, trace metric, reference data, scope and exceptions.","asset_ids":["POE-ASSET-0003","POE-ASSET-0138"],"verification_method":"Recompute named metrics from independent fixtures; no aggregate claim without locators","status":"NOT_EVALUATED","deviation":null,"approver":null,"gate":"G7","evidence_state":"LOCATED_NOT_REQUALIFIED"},{"requirement_id":"POE-REQ-018","source_locator":"Acceptance package and approval requirement","criterion":"Trace every acceptance conclusion to evidence, deviation disposition and named approver.","asset_ids":["POE-ASSET-0002","POE-ASSET-0138","POE-ASSET-0139"],"verification_method":"Acceptance matrix and approval audit","status":"NOT_EVALUATED","deviation":null,"approver":null,"gate":"G17","evidence_state":"LOCATED_NOT_REQUALIFIED"}],"coverage":{"registered":18,"total_identified":18},"technical_approval":"NOT_EVALUATED"}
